{
  "schemaVersion": "cautilus.skill_evaluation_inputs.v1",
  "skillId": "impl",
  "skillDisplayName": "impl",
  "evaluations": [
    {
      "evaluationId": "trigger-impl-positive",
      "targetKind": "public_skill",
      "targetId": "impl",
      "displayName": "impl",
      "evaluationKind": "trigger",
      "prompt": "Please implement one bounded repo-local quality slice.",
      "startedAt": "2026-04-14T00:00:00.000Z",
      "expectedTrigger": "must_invoke",
      "expectedRouting": {
        "selectedSkill": "impl"
      },
      "invoked": true,
      "summary": "The prompt clearly called for the impl skill and the skill was invoked.",
      "routingDecision": {
        "selectedSkill": "impl",
        "selectedSupport": null,
        "firstToolCall": "impl --repo-root .",
        "reasonSummary": "The prompt directly requested implementation work."
      },
      "instructionSurface": {
        "surfaceLabel": "workspace_checked_in",
        "files": [
          {
            "path": "AGENTS.md",
            "sourceKind": "workspace_default",
            "artifactPath": "artifacts/instruction-surface/AGENTS.md"
          }
        ]
      }
    },
    {
      "evaluationId": "execution-impl-clean",
      "targetKind": "public_skill",
      "targetId": "impl",
      "displayName": "impl",
      "evaluationKind": "execution",
      "prompt": "Apply the bounded change and verify it.",
      "startedAt": "2026-04-14T00:05:00.000Z",
      "invoked": true,
      "outcome": "passed",
      "summary": "The skill completed the bounded change and stayed within the declared runtime budget.",
      "routingDecision": {
        "selectedSkill": "impl",
        "selectedSupport": null,
        "firstToolCall": "impl --repo-root .",
        "reasonSummary": "The same impl route handled the bounded change request."
      },
      "metrics": {
        "total_tokens": 700,
        "duration_ms": 1800
      },
      "thresholds": {
        "max_total_tokens": 1000,
        "max_duration_ms": 3000
      },
      "artifactRefs": [
        {
          "kind": "transcript",
          "path": "artifacts/skills/impl/execution-impl-clean/transcript.md"
        }
      ]
    }
  ]
}
